<?xml version="1.0" encoding="UTF-8" ?>
<!--Scontrino GeoStore per l'ordinazione prodotto-->
<!DOCTYPE Scontrino SYSTEM "formatReceiptTD.dtd">
<?xml-stylesheet type="text/xsl" href="styleReceiptTD.xsl" ?>
<Scontrino>
    <Intestazione>
        <nomeNegozio>Negozio virtuale GeoStore</nomeNegozio>
        <via>Sede virtuale</via>
    </Intestazione>
    <Corpo>
        <TitoloTabella>
            <colonnaT1>PRODOTTO</colonnaT1>
            <colonnaT2>PREZZO (C)</colonnaT2>
        </TitoloTabella>
        <CorpoTabella>
            <colonnaC1>xxPRODUCTxx</colonnaC1>
            <colonnaC2>xxPRICExx</colonnaC2>
        </CorpoTabella>
    </Corpo>
    <PiedeDataOrdini>
        <colonnaPDT>DATA ORDINI</colonnaPDT>
        <colonnaPDC>xxORDERSDATExx</colonnaPDC>
    </PiedeDataOrdini>
    <PiedeTotale>
        <colonnaPT>TOTALE</colonnaPT>
        <colonnaPC>xxTOTALPRICExx</colonnaPC>
    </PiedeTotale>
    <Didascalia>
        <DidascaliaTitolo>
            <colonnaDT>ID Documento:</colonnaDT>
            <colonnaNT>Cliente</colonnaNT>
        </DidascaliaTitolo>
        <DidascaliaCorpo>
            <colonnaDC>xxCHMxx</colonnaDC>
            <colonnaNC>xxUSERxx</colonnaNC>
        </DidascaliaCorpo>
    </Didascalia>

</Scontrino>
